{
  "name": "Production API",
  "url": "https://example.com",
  "http_method": "GET",
  "cause": "Connection timeout",
  "started_at": "2026-04-18T14:00:00Z",
  "acknowledged_at": "2026-04-18T14:05:00Z",
  "resolved_at": "2026-04-18T14:15:00Z",
  "status": "Resolved",
  "team_name": "my-team",
  "regions": [
    "us"
  ]
}